{
  "$schema": "http://json-schema.org/schema#",
  "id": "https://legumefederation.org/schemas/cmap.json",
  "title" : "cmap-js schema",
  "description" : "For more info, see https://github.com/ncgr/cmap-js",
  "type" : "object",
  "properties" : {
    "#" : { "type" : "string"},
    "header" : { "type" : "string"},
    "attribution" : { "type" : "string" },
    "initialView" : {
      "type" : "array",
      "items" : { "type": "string" }
    },
    "sources" : {
      "type" : "array",
      "items" : {
        "type" : "object",
        "properties" : {
          "#" : { "type": "string" },
          "uniquePrefix" : { "type" : "string" },
          "method" : { "type" : "string"},
          "data" : { "type" : "object" },
          "url" : { "type" : "string" }
        }
      }
    }
  },
  "required": ["header", "attribution", "sources"]
}
